{
  "$schema": "https://json-schema.org/draft/2020-12/schema",
  "$id": "https://trainer-psy-air.local/schema/family.schema.json",
  "title": "TestFamily",
  "description": "One activity family of a module (e.g. PSY0 > memory_nback). File: assets/content/<module>/families/<family>.json (v2). Also defines Module (assets/content/<module>/module.json) under $defs.",
  "type": "object",
  "properties": {
    "$schema": { "type": "string" },
    "kind": { "const": "family" },
    "id": { "$ref": "common.schema.json#/$defs/Id", "description": "Short slug, no dots, equal to engineType for PSY0: memory_nback, planning_tubes, attention_rules, attention_parity, spatial_overlay, logic_dominos, attention_airways, verbal_boxes, arithmetic_grid, spatial_viewpoint, spatial_cubes, culture_aero, multitask_psychomotor, english_reading (+ english_listening, english_speaking)." },
    "moduleId": { "$ref": "common.schema.json#/$defs/ModuleId" },
    "version": { "$ref": "common.schema.json#/$defs/Version" },
    "order": { "type": "integer", "minimum": 0, "description": "Display order in the Learn home and default order in blueprints." },
    "name": { "$ref": "common.schema.json#/$defs/LocalizedText" },
    "shortName": { "$ref": "common.schema.json#/$defs/LocalizedText", "description": "<= 14 chars, for chips and charts." },
    "description": { "$ref": "common.schema.json#/$defs/LocalizedText", "description": "What is evaluated and how (markdown, 2-4 sentences). Shown on the family card (US-040)." },
    "engineType": {
      "type": "string",
      "description": "Key of the engine that runs this family (US-020 registry): the 14 PSY0 activity families of EPIC-03 plus the English sub-families. Bank-driven engines (culture_aero, english_*) read McqItems from files; the others own a generator (see `generatorId`).",
      "enum": [
        "memory_nback",
        "planning_tubes",
        "attention_rules",
        "attention_parity",
        "spatial_overlay",
        "logic_dominos",
        "attention_airways",
        "verbal_boxes",
        "arithmetic_grid",
        "spatial_viewpoint",
        "spatial_cubes",
        "culture_aero",
        "multitask_psychomotor",
        "english_reading",
        "english_grammar",
        "english_listening",
        "english_speaking"
      ]
    },
    "generatorId": { "$ref": "generators.schema.json#/$defs/GeneratorId", "description": "v2: generator the practice launcher uses for this family (omit for bank-driven families)." },
    "answerFormat": {
      "type": "string",
      "description": "Primary answer widget. mcq: options; numeric: keypad; sequence: recall; grid: tap cells; tap: tap-on-stimulus; key_press: keyboard keys at a cadence; click_sequence: ordered clicks; drag: drag & drop; multi_select: toggle cells then validate; simulation: continuous interaction; recording: microphone self-recording.",
      "enum": ["mcq", "numeric", "sequence", "grid", "tap", "key_press", "click_sequence", "drag", "multi_select", "simulation", "recording"]
    },
    "inputRequirement": { "$ref": "common.schema.json#/$defs/InputRequirement" },
    "liveFeedback": { "type": "boolean", "default": false, "description": "v2: the real activity shows right/wrong feedback live; engines keep it in exam mode." },
    "lang": { "$ref": "common.schema.json#/$defs/Lang", "default": "fr", "description": "Default stimulus language of the family's items." },
    "defaultDurationSec": { "type": "integer", "minimum": 30, "maximum": 7200, "description": "Section duration used by the practice launcher and by blueprints that do not override it." },
    "defaultItemCount": { "type": "integer", "minimum": 1, "maximum": 500 },
    "defaultPerItemTimeSec": { "type": "integer", "minimum": 1, "description": "Optional per-item limit (speeded families)." },
    "defaultCadence": { "$ref": "common.schema.json#/$defs/Cadence", "description": "v2: fixed-rhythm families (memory_nback, attention_rules)." },
    "confidence": { "$ref": "common.schema.json#/$defs/Confidence", "description": "Confidence in duration/itemCount versus the real test. Mark `assumed` until US-080 confirms." },
    "tags": { "$ref": "common.schema.json#/$defs/Tags", "description": "Root of the tag vocabulary for this family, e.g. ['english']." },
    "status": { "$ref": "common.schema.json#/$defs/Status" },
    "meta": { "$ref": "common.schema.json#/$defs/Meta" }
  },
  "required": ["kind", "id", "moduleId", "version", "order", "name", "description", "engineType", "answerFormat", "defaultDurationSec", "defaultItemCount", "confidence"],
  "additionalProperties": false,
  "$defs": {
    "Module": {
      "type": "object",
      "description": "A selection stage. File: assets/content/<module>/module.json.",
      "properties": {
        "$schema": { "type": "string" },
        "kind": { "const": "module" },
        "id": { "$ref": "common.schema.json#/$defs/ModuleId" },
        "version": { "$ref": "common.schema.json#/$defs/Version" },
        "order": { "type": "integer", "minimum": 0 },
        "name": { "$ref": "common.schema.json#/$defs/LocalizedText" },
        "description": { "$ref": "common.schema.json#/$defs/LocalizedText" },
        "familyIds": {
          "type": "array",
          "items": { "$ref": "common.schema.json#/$defs/Id" },
          "uniqueItems": true,
          "description": "Ordered list of family folders under this module."
        },
        "defaultBlueprintId": { "$ref": "common.schema.json#/$defs/Id" },
        "status": { "$ref": "common.schema.json#/$defs/Status" }
      },
      "required": ["kind", "id", "version", "order", "name", "description", "familyIds"],
      "additionalProperties": false
    }
  }
}
