{
  "$schema": "../../../../../../packages/psy_content/schema/family.schema.json",
  "kind": "family",
  "id": "memory_nback",
  "moduleId": "psy0",
  "version": 1,
  "order": 1,
  "name": {
    "fr": "Mémoire N-back",
    "en": "Memory N-back"
  },
  "shortName": {
    "fr": "N-back",
    "en": "N-back"
  },
  "description": {
    "fr": "Un stimulus (couleur ou chiffre) s'affiche environ 1 s ; répondez **oui / non** selon qu'il est identique à celui affiché 2 rangs plus tôt. 1,5 s pour répondre, une absence de réponse compte comme une erreur. 42 stimuli dont 2 amorces.",
    "en": "A stimulus (colour or digit) shows for about 1 s; answer **yes / no** whether it equals the one shown 2 steps earlier. 1.5 s to answer, no answer counts as an error. 42 stimuli including 2 primers."
  },
  "engineType": "memory_nback",
  "generatorId": "nback",
  "answerFormat": "key_press",
  "inputRequirement": "touch",
  "liveFeedback": false,
  "lang": "fr",
  "defaultDurationSec": 105,
  "defaultItemCount": 42,
  "defaultCadence": {
    "stimulusMs": 1000,
    "answerWindowMs": 1500
  },
  "confidence": "reported",
  "tags": [
    "memory"
  ],
  "meta": {
    "source": "docs/content/psy0-spec.md §2.4-A, §3.1 row 1 (count and cadence reported 2019-2026)"
  }
}
