{
  "$schema": "../../../../../../packages/psy_content/schema/family.schema.json",
  "kind": "family",
  "id": "multitask_psychomotor",
  "moduleId": "psy0",
  "version": 1,
  "order": 13,
  "name": {
    "fr": "Multitâche psychomoteur",
    "en": "Psychomotor multitask"
  },
  "shortName": {
    "fr": "Multitâche",
    "en": "Multitask"
  },
  "description": {
    "fr": "Pendant 5 minutes : maintenez la **flèche** du clavier dans la direction où se déplace un cercle (poursuite), appuyez sur **Espace** quand la forme dans le cercle est identique à la forme de référence, appuyez sur **F** quand le calcul encadré est faux. Clavier physique indispensable ; l'adaptation tactile n'est pas représentative.",
    "en": "For 5 minutes: hold the keyboard **arrow** in the direction a circle moves (tracking), press **Space** when the shape inside the circle equals the reference shape, press **F** when the framed calculation is wrong. Physical keyboard required; the touch adaptation is not representative."
  },
  "engineType": "multitask_psychomotor",
  "generatorId": "multitask",
  "answerFormat": "simulation",
  "inputRequirement": "keyboard",
  "liveFeedback": false,
  "lang": "fr",
  "defaultDurationSec": 300,
  "defaultItemCount": 1,
  "confidence": "reported",
  "tags": [
    "multitask"
  ],
  "meta": {
    "source": "docs/content/psy0-spec.md §2.4-M, §3.1 row 13, §4.4 platform note"
  }
}
