{
  "$schema": "../../../../docs/content/schema/family.schema.json",
  "kind": "family",
  "id": "english",
  "moduleId": "psy0",
  "version": 1,
  "order": 14,
  "name": {
    "fr": "Anglais",
    "en": "English"
  },
  "shortName": {
    "fr": "Anglais",
    "en": "English"
  },
  "description": {
    "fr": "QCM de type TOEIC sur des textes, images et graphiques ; le texte reste consultable pendant les questions. Environ 45 questions en 30 minutes, minutage serré. Niveau visé B2 / C1. La banque contient aussi des exercices de grammaire et de vocabulaire (entraînement secondaire).",
    "en": "TOEIC-like MCQ on texts, images and charts; the passage stays available while answering. About 45 questions in 30 minutes, tight timing. Target level B2 / C1. The bank also holds grammar and vocabulary drills (secondary practice)."
  },
  "engineType": "english_reading",
  "answerFormat": "mcq",
  "inputRequirement": "touch",
  "liveFeedback": false,
  "lang": "en",
  "defaultDurationSec": 1800,
  "defaultItemCount": 45,
  "defaultPerItemTimeSec": 40,
  "confidence": "reported",
  "tags": [
    "english"
  ],
  "meta": {
    "source": "docs/content/psy0-spec.md §2.4-O, §3.1 row 14a (reported 2022-2025; items authored in US-082)"
  }
}
