{
  "$schema": "../../../../docs/content/schema/family.schema.json",
  "kind": "family",
  "id": "attention_parity",
  "moduleId": "psy0",
  "version": 1,
  "order": 4,
  "name": {
    "fr": "Pair / impair",
    "en": "Even / odd"
  },
  "shortName": {
    "fr": "Pair/impair",
    "en": "Parity"
  },
  "description": {
    "fr": "Un nuage de nombres. À partir de START, cliquez alternativement un nombre **pair** puis un nombre **impair**, chaque catégorie dans l'ordre croissant, jusqu'à END. Une erreur fait recommencer la série.",
    "en": "A cloud of numbers. From START, click alternately an **even** then an **odd** number, each category in ascending order, until END. An error restarts the series."
  },
  "engineType": "attention_parity",
  "generatorId": "parity_sequence",
  "answerFormat": "click_sequence",
  "inputRequirement": "touch",
  "liveFeedback": true,
  "lang": "fr",
  "defaultDurationSec": 300,
  "defaultItemCount": 5,
  "defaultPerItemTimeSec": 60,
  "confidence": "reported",
  "tags": [
    "attention"
  ],
  "meta": {
    "source": "docs/content/psy0-spec.md §2.4-D, §3.1 row 4 (5 series reported 2022-2023)"
  }
}
